{
  "id": "w2-p6-stock",
  "version": 1,
  "title": "It won't look like a screen",
  "series": {
    "name": "7 things nobody tells you before your first time",
    "part": 6,
    "total": 7,
    "label": "Nobody tells you this · 6 of 7"
  },
  "voice": {
    "preset": "james-default"
  },
  "beats": [
    {
      "id": "hook",
      "role": "hook",
      "vo": "Your first time will not look like what you've seen on a screen — and that's good news.",
      "visual": {
        "type": "solid",
        "color": "bg"
      },
      "overlay": {
        "text": "Your first time won't look like what you've seen on a screen.",
        "style": "hook_slam",
        "position": "center"
      },
      "visual_intent": "Dim bedroom window at night, curtains, empty room. No people.",
      "search_queries": [
        "bedroom window night",
        "dark room curtains",
        "night window city lights"
      ]
    },
    {
      "id": "series_intro",
      "role": "context",
      "vo": "This is number six of the seven things nobody tells you; follow so you don't miss number one, it's the big one.",
      "visual": {
        "type": "typography",
        "text": "6",
        "style": "number"
      }
    },
    {
      "id": "point",
      "role": "body",
      "vo": "Six: there'll be pauses. Something will be awkward. Somebody might laugh.",
      "visual": {
        "type": "solid",
        "color": "bg"
      },
      "overlay": {
        "text": "Pauses. Awkwardness. A laugh.",
        "style": "card",
        "position": "upper"
      },
      "visual_intent": "Slow, quiet moment: hands fidgeting, a pause. Hands only, no faces.",
      "search_queries": [
        "hands clasped waiting room",
        "closed fists on table",
        "person rubbing hands nervously"
      ]
    },
    {
      "id": "reframe",
      "role": "body",
      "vo": "That's not it going wrong — that's what real looks like. The guys who panic are the ones expecting a performance.",
      "visual": {
        "type": "clip",
        "asset": "clips/pixabay-293332.mp4"
      },
      "visual_intent": "Ordinary real life, unpolished: an empty city street at dusk.",
      "search_queries": [
        "empty street dusk",
        "city street evening",
        "quiet street lights"
      ]
    },
    {
      "id": "payoff",
      "role": "payoff",
      "vo": "So walk in expecting real, not a highlight reel.",
      "visual": {
        "type": "solid",
        "color": "bg"
      },
      "visual_intent": "Walking into something calmly: an open doorway with warm light.",
      "search_queries": [
        "open doorway light",
        "door light hallway",
        "warm hallway"
      ]
    },
    {
      "id": "payoff_statement",
      "role": "payoff",
      "vo": "Hold onto this: awkward is normal, and it passes.",
      "visual": {
        "type": "typography",
        "text": "Awkward is normal. It passes.",
        "style": "statement"
      },
      "captions_hidden": true
    },
    {
      "id": "tease",
      "role": "tease",
      "vo": "Number five next — it's the one that takes all the pressure off you.",
      "visual": {
        "type": "solid",
        "color": "bg"
      },
      "visual_intent": "Silhouette walking away, backlit, anonymous.",
      "search_queries": [
        "distant figure walking beach upper frame",
        "small silhouette wide horizon"
      ]
    }
  ],
  "cta_pop": {
    "text": "Follow for all 7",
    "start": {
      "beat_id": "hook",
      "phrase": "and that's good news"
    },
    "duration_sec": 2.5,
    "style": "pill"
  },
  "captions": {
    "enabled": true,
    "style": "word_highlight"
  },
  "end_card": {
    "enabled": false
  },
  "disclosure": {
    "ai_generated_label": true
  },
  "meta": {
    "purpose": "M5b working spec: the media fixture with its placeholder still/clip beats turned back into un-sourced beats (solid + visual_intent + search_queries) so `studio assets` has something to fill. `--pick` rewrites them in place.",
    "caption": "#6 of 7. It's not supposed to look like that. Follow — #1 changes everything."
  },
  "music": {
    "file": "music/bed-01.mp3",
    "gain_db": -22,
    "duck_under_vo": true,
    "license_note": "Generated locally with ffmpeg sine synthesis (placeholder fixture); no third-party rights."
  }
}
