{
  "id": "w2-p6-media",
  "version": 1,
  "title": "It won't look like a screen",
  "series": {
    "name": "7 things nobody tells you before your first time",
    "part": 6,
    "total": 7,
    "label": "Nobody tells you this · 6 of 7"
  },
  "voice": {
    "preset": "james-default"
  },
  "beats": [
    {
      "id": "hook",
      "role": "hook",
      "vo": "Your first time will not look like what you've seen on a screen — and that's good news.",
      "visual": {
        "type": "still",
        "asset": "stills/dusk-window.png",
        "motion": "push_in"
      },
      "overlay": {
        "text": "Your first time won't look like what you've seen on a screen.",
        "style": "hook_slam",
        "position": "center"
      }
    },
    {
      "id": "series_intro",
      "role": "context",
      "vo": "This is number six of the seven things nobody tells you; follow so you don't miss number one, it's the big one.",
      "visual": {
        "type": "typography",
        "text": "6",
        "style": "number"
      }
    },
    {
      "id": "point",
      "role": "body",
      "vo": "Six: there'll be pauses. Something will be awkward. Somebody might laugh.",
      "visual": {
        "type": "clip",
        "asset": "clips/grid-counter.mp4"
      },
      "overlay": {
        "text": "Pauses. Awkwardness. A laugh.",
        "style": "card",
        "position": "upper"
      }
    },
    {
      "id": "reframe",
      "role": "body",
      "vo": "That's not it going wrong — that's what real looks like. The guys who panic are the ones expecting a performance.",
      "visual": {
        "type": "still",
        "asset": "stills/warm-room.png",
        "motion": "pan_left"
      }
    },
    {
      "id": "payoff",
      "role": "payoff",
      "vo": "So walk in expecting real, not a highlight reel.",
      "visual": {
        "type": "still",
        "asset": "stills/street-night.png",
        "motion": "pull_out"
      }
    },
    {
      "id": "payoff_statement",
      "role": "payoff",
      "vo": "Hold onto this: awkward is normal, and it passes.",
      "visual": {
        "type": "typography",
        "text": "Awkward is normal. It passes.",
        "style": "statement"
      },
      "captions_hidden": true
    },
    {
      "id": "tease",
      "role": "tease",
      "vo": "Number five next — it's the one that takes all the pressure off you.",
      "visual": {
        "type": "still",
        "asset": "stills/warm-room.png",
        "motion": "pan_right"
      }
    }
  ],
  "cta_pop": {
    "text": "Follow for all 7",
    "start": {
      "beat_id": "hook",
      "phrase": "and that's good news"
    },
    "duration_sec": 2.5,
    "style": "pill"
  },
  "captions": {
    "enabled": true,
    "style": "word_highlight"
  },
  "end_card": {
    "enabled": false
  },
  "disclosure": {
    "ai_generated_label": true
  },
  "meta": {
    "purpose": "M5 fixture. Same script as w2-p6 (shares its TTS cache) with still/clip backgrounds and a music bed. Assets are generated placeholders, not real photography.",
    "caption": "#6 of 7. It's not supposed to look like that. Follow — #1 changes everything."
  },
  "music": {
    "file": "music/bed-01.mp3",
    "gain_db": -22,
    "duck_under_vo": true,
    "license_note": "Generated locally with ffmpeg sine synthesis (placeholder fixture); no third-party rights."
  }
}
